{
  "finding_id": "f86e87c82e2e8bd2a3cb149cf20f21734158d6b9092caa35f06b5a487a44b2b7",
  "identity_model": "state",
  "identity_version": 2,
  "scope_id": "scope:lab",
  "rule_id": "cve.version-match",
  "subject_id": "asset:lab-host-1:software:example-browser@3.2.1:cve:CVE-2026-12345",
  "status": "open",
  "first_seen": "2026-10-12T06:00:00Z",
  "last_seen": "2026-10-13T06:00:00Z",
  "observation_count": 2,
  "latest_observation_id": "9eacbf28d0bc4d9b1aada2577bd157dec90b007c8bcea681ff68c229693390ef"
}